Id,Question,A,B,C,D
1,Are you often late?,Never,Sometimes it happens,"Yes, it happens often",
2,What do you pay attention to when first meeting a new person?,,Their opinion of me,Appearance,Their ability to talk 
3,What is fits you better?,Leaving your comfort zone,Comfort and stability,,
4,Do you think you have leadership qualities?,"Yes, I'm natural leader",Something between yes and no,"No, it's not me",I'd really like to become a leader
5,What is most important for you in a relationship?,Mutual understanding,"Drive, fun",Loyalty ,Calmness and stability
6,Are you a practical person?,"No, it's not me","Yes, I try to be practical",,
7,Someone nearby is offended and is not talking. What is your reaction?,Try to figure out what's wrong,"Ignore, I don't like manipulation",Start to apologize immediately,Get mad as well
8,Does a person's star sign matter to you?,"Yes, astrology is important","No, I don’t care about it ",,
9,What sphere of life is your priority right now?,Love life,Career,Health and fitness,
10,What role does spontaneity play in your life?,"I love spontaneity, improvization, flying by the seat of my pants",I prefer to stick to a plan,A bit of both,
11,How do you react to outside pressure?,"Resist, react violently",Calmly uphold personal boundaries,I'm okay with it,"Get lost, don't know how to react"
12,What type of thinking is closer to yours?,,,,
13,How easily do you get carried away with a new idea or direction?,"Easy, let's turn that new idea into a reality",Quickly light up with eagerness and then quickly burn out,I rarely have ideas,
14,How do you rate your level of cooking?,Fabulous,It's better not to feed anyone,"Middling
",Can't cook
15,What kind of music do you prefer?,,,,I'm a music lover
16,How do you express your emotions?,I express them openly,I don't show my true emotions,,
17,How do you feel about debates?,Don't mind arguing,Don't like to get into it,Depends on who I'm talking to,Only if the topic of the debate is very important to me
18,How long do you remember the mistakes of past relationships?,,,,
19,Do you like shopping?,,,Depends on my mood,Rarely go shopping
20,What is more typical for you?,Sense of duty and responsibility,"Thinking about myself, protecting my inner world",I do what I want but keep everything in line,"Enjoy life, have freedom"
21,Rate your openness to people,I'm sociable and optimistic,"I'm shy, prone to introspection",,
22,Do emotions affect your productivity?,,,,
23,Do you feel like your motives are similar to those of other people?,"Yes, my values are the same","No, I'm a bit of a rebel",Their motives are not credible,
24,Are other people's moral values important to you?,"Yes, definitely","No, it's not a very important thing for me",,
25,Do you have a habit of dramatizing certain situations?,"Yes, I'm a very emotional person","Happens, but rarely",,
26,Does routine cause a sharp decline in your mood?,"Yes, I can't live in a routine","No, I'm quite calm about it",Always different,
27,Are you often unable to sit still?,,,,
28,Are you straight shooter?,"Yes, I prefer to tell only the truth, whatever it is","No, I'm more delicate",Depends on the person,
29,Are you an enterprising person?,,,Depends on the situation,
30,Do you make decisions quickly?,,,,
31,"Can your mood be called, sharply changeable?","Yes, I'm prone to mood swings","No, I'm emotionally balanced ",Only in certain periods,I'm bad at keeping track of my mood
32,Can you be called a stubborn person?,"Yes, I can't be convinced of anything","No, I can compromise",Depends on the situation or company,
33,"Are you aggressive in achieving your goals?
","Yes, I can step on people to achieve it",I'm reluctant to reach my goals,,
34,Are you tolerant to others' shortcomings?,,,,
35,Can you take a risk easily?,"Yes, I love risk and excitement","No, I'm a more careful person",,
36,"Is the phrase ""The best defense is a good offense"" about you?",,,,
37,Do you get pissed off easily?,"Yes, I'm quite hot-tempered","No, I'm not easy to piss off",Depends on the period,I don’t like to show aggression
38,Which temperament is closer to yours?,,,,
39,Can people be trusted?,"Yes, I'm very open to others","Trust, but verify",Always different,"No, I don't trust other people"
40,Do you still remember your childhood grudges?,"Yes, grievances remain",,"No, I don't notice",I think it's pointless to hold grudges
41,Do you like competition?,"Yes, it gets me excited",Depends on the situation,No I don't like this,It scares me
42,"Is the phrase ""I've learned that it's important not to expect too much from others"" true to you?",,,,
43,I prefer when...,I'm taken care of,I take care of someone,,
44,Is the world a safe place?,,,,
45,Is it hard for you to find the motivation to take action?,"Yes, I need more time to start","No, I can easily get to work",,
46,Are you quick to mobilize in crisis situations?,"Yes, I don't lose my cool in a crisis","No, emotions take over and I get lost",,
47,Do you feel happy helping others?,,,,
48,Are you always looking out best for yourself?,"Yes, I strive for a better life",I don't always find motivation,"No, this is not about me",
49,Do you love many people?,,Only close people,,
50,Are you always looking for ways to improve yourself?,"Yes, this is me
","No, it's not important for me",Depends on the period,
51,Is a relationship the meaning of life for you?,"Yes, I feel incomplete without it","No, it's not important for me",I'm neutral,
52,"Is the phrase ""I like introducing people to one another"" about you?",,,,
53,"Do you find it difficult to say ""NO""?","Yes, it's hard for me to refuse things","No, I can easy refuse things",,
54,Do you consider other people's needs more important than your own?,Their interests are more important than mine,"No, I focus more on my own issues",,
55,Are you romantic?,,,,
56,Do you only feel fulfilled when you feel in love?,,,,
57,Can you find your way out of difficult situations?,"Yes, I can be a crisis manager","No, it's hard for me",Always different,
58,"Is the phrase ""I'm the creator of my own life"" about you?","Yes, everything depends on my thoughts and actions","No, everything is predetermined by fate",,
59,"Do you know how to manage people (collective, team, etc.)?","Yes, I influence others a lot","No, but I'd like to",,
60,What is your rhythm of life?,"Dynamic, active","Calm, measured",,
61,Is your life changing quickly?,"Yes, my life is constantly changing","No, haven't noticed it",,
62,What is fits you better?,I have more good ideas than time for implementation ,More time than ideas,,
63,Do you find your life boring?,"Yes, I feel the absence of bright colors ","No, it is filled with various impressions",,
64,Do great achievements come to you without much effort?,I easily achieve success in my plans,"No, not without difficulty, I need to try",,
65,Do you try to keep everything under control?,"Yes, I'm a terrible controller","No, I trust the world",,
66,Do big changes in life throw you off balance?,"Yes, it's hard to adapt to change","No, I love change",,
67,Do you get inspired easily?,"Yes, I easily get caught up in creative impulses","No, I need to try and catch inspiration",It comes very rarely,
68,Do you like taking responsibility?,"Yes, this is normal for me","Not really, it's hard for me",,
69,Do people consider you a creative person?,"It's true, I love new ideas",This isn't me,,
70,Do failures really unsettle you?,Problems greatly affect me,"No, I try to focus on the positive","I learn from mistakes, I take failures lightly",
71,Do you have a good imagination?,"I like to dream, it comes easily to me","No, not really",,
72,Do you believe that our thoughts affect our reality?,"Yes, thoughts are material","No, I only believe in scientifically proven facts",,
73,Do you try to look at situations from different angles?,,,,
74,Do you believe that everything in the world is interconnected?,"Yes, everything is interconnected via energy","No, I don't believe it",,
75,Are you used to thinking deeply?,"Yes, I don't like thinking superficially","No, it's out of character for me",,
76,Do you consider yourself a fun person?,"Yes, I have a talent for making people laugh","No, I'm more serious",,
77,Is your presence a catalyst for change?,"Yes, I often influence the course of events","No, haven't noticed it",,
78,"Is the phrase ""I always strive to find the truth"" about you?","Yes, I always try to get to the bottom of things","No, it's not important for me",,
79,What type do you consider yourself more?,I'm a person who bases things on scientific facts,I am a person who is close to the world of magic,,
80,Do people often seek advice from you?,,,,
81,Do you joke a lot?,I'm a born comedian,,,
82,Do you like solving complex problems?,,,,
83,What mode of travel do you prefer?,Ride a bike,Ride a horse,Drive,
84,"Do you like to give other people nicknames, cute names?",,,,
85,Do you like to receive or make surprises?,Receive surprises,Make surprises for others,,
86,What would you like more: winning the lottery or having the perfect job?,Win the jackpot,Get my dream job,,
87,Which animal do you associate yourself with?,Tiger,Owl,Rabbit,Sloth
88,Are family traditions important to you?,"Yes, I try to keep them ",,,
89,What do you prefer: sports or art?,,,,Neither of these
90,How do you feel about cleanliness?,I call myself very clean,,Sometimes I have to force myself to keep clean,
91,Are you a vindictive person?,"Yes, I remember others' mistakes ","No, I quickly move on ",Depends on the situation,
92,Are you satisfied with yourself at the moment?,"Yes, I'm happy with who I am now","Yes, but it could be better","No, I'm not happy with myself now",
93,Do you set global goals?,"I'm for global, large-scale goals",I'm for more realistic goals,,
94,"If you work in a noisy environment, do you get tired faster?","Yes, I get tired faster in a noisy place","No, noise does not interfere with my work",,
95,Do you think back to troubles you've been through?,I see no reason to go back to them,I often analyze them,"Sometimes, but not always",
96,How do you feel about criticism?,I take criticism well,"Criticism hurts me, makes me vulnerable",,
97,Are you highly sensitive to fragrances?,,,,
98,"When you get into a new environment, do you quickly adapt?",,,,
99,Which method of completing tasks is closer to yours?,I'm all about multitasking,I focus on one thing at a time,,
100,Do you get very nervous when speaking in front of an audience?,,,,
101,How do you feel about contemplating nature?,I love taking in the beauty of nature,I'm not interested,,
102,"When you are very tired, do you easily get angry?","Yes, I get irritated quickly","No, I'm always calm",,
103,Does your emotional state affect your productivity?,,,,
104,"Do you like pronounced tastes (salty, bitter, sour, sweet)?","Yes, I love any flavor description starting with ""too much""","No, I have more neutral tastes",,
105,Do you have trouble letting go of people who were close to your heart for a long time?,"Yes, I have a hard time parting with people ","No, I easily let go",,
106,"If you are excited about something, do you talk about it frequently?","Yes, I can not remain silent about something that worries me","No, I prefer to voice my feelings only once",I don't talk about my feelings at all,
107,How often are you shy in front of something or someone?,I don't know what shyness is,"Sometimes I'm shy, but rarely",I often notice my shyness,
108,Is it easy for you to talk to a person you don't know?,"Yes, I'm an acquaintance master",,"It's difficult for me, better if someone would start talking to me first",
109,Do you consider yourself dexterous and sharp?,,,,
110,"If you don’t get enough sleep, do a lot of things annoy you?","Yes, it's better not to make me angry in the morning","No, nothing affects me in the morning",,
111,Are you more inclined to think or act?,,,,
112,Do you notice the subtleties in semi-tones of aromas and tastes well?,,,,
113,Are you a man of duty?,,Depends on the circumstances,I don't like to take responsibility,
114,"If you are asked to name your top three qualities, which would you choose?","Enthusiasm, independence, activity","Sociability, openness, ease","Hard work, perseverance, restraint","Emotionality, sensitivity, tenderness"
115,What would you say if you were asked to name your biggest shortcoming?,Сloseness,Emotionality,Frivolity,Inconsistency
116,What does true love mean to you?,"Passion, drive, dynamics","Depth, sensitivity, and understanding ",Responsibility,Common interests and conversations
117,"You are working on a group project, what role will you take?",I will act as the leader,"I will analyze, study, plan",I will perform,"I experiment, generate new ideas"
118,Is money an important part of happiness?,,,,
119,Are you living up to other people's expectations?,"Yes, I try to do it","No, I'm independent of their opinions",Only the dearest of people,
120,Do you like it when your day is already planned out?,I love a clear plan,I like to leave space for spontaneity,,
121,Do you like intellectual riddles and puzzles?,"Yes, I like to think hard about certain tasks",,,
122,Is it important for you to understand the essence of a situations as it unfold?,,,,
123,How much time do you devote to your hobbies?,A lot of time,I'm trying to make enough time,I don't make any time for hobbies,
124,Can you carry any conversation?,,,,
125,Do you like to stand out among others?,I love being in the center of things ,I don't like to stand out,,
126,"Is phrase ""I constantly need new sensations and adventures"" about you?",I love new experiences,"No, not for me",,
127,Do you consider yourself an unconventional person?,,,,
128,Do you consider yourself a loyal person?,,,,
129,Do you consider yourself a perfectionist?,I try to do everything perfectly,,,
130,Do you often have to redo the work of others?,"Yes, no one gets the job done the way I do",,,
131,Do you try to avoid any confrontation?,,,,
132,Do you often find yourself on the side of the rebels?,"Yes, I like to go against established systems","No, I follow established rules",,
133,How easily can you get moved and cry?,I'm a sentimental person,,I'm an emotionally stable person,
134,"To feel like an accomplished person, you try to be...",Empathic and helpful,Calm and balanced,Cheerful optimist,"Discreet, serious, and thoughtful"
135,"In your eyes, you are, first of all, a .... person ",Strong and authoritative,Executive and responsible,Gentle and sensitive,Funny and interesting
136,You gladly...,Fight for justice,Achieve goals,Obtain knowledge,Help others
137,What type of thinking is closer to yours?,I make decisions based on facts and experience,I listen to intuition,,
138,How do you complete tasks?,Spending effort evenly on tasks,Leaving everything for the last day,,
139,Do you pay attention to how others feel about you?,I don't care about people's indifference,I worry about the coldness of people,,
140,Mind or heart?,Logic and reason are more important for me than feelings,The heart guides me more often than reasoning,,
141,How do you attract the attention of people around you?,With a sharp mind,Emotional sensitivity,,
142,What do you think about freelance work?,I really like this way of working,I'm in favor of a clearer work schedule,,
143,What pace of work are you comfortable with?,Fast and dynamic work,Slow and thoughtful work,,
144,"When you create something, you'd rather...",Outline everything with large strokes,Thinking through everything down to the finest detail,,
145,"When you have something to say, you...",Wait for the right moment to speak up,Express your opinion right away,,
146,Do you share your experiences with others?,I share my experiences ,Only with close people,I prefer to keep all my worries to myself,
147,Which love language is closer to you?,,,,
148,Your ideal partner has such a basic quality as...,Caring,"Activity, ambition",Devotion,Intelligence
149,What role does religion play in your life?,I need religion in my life,I'm neutral about it,I don’t attach any importance to this area of ​​life,
150,Do you choose partners somewhat similar to your parent?,"Yes, I noticed similarities with my parent","No, I haven't noticed it",I try to choose a partner who does not look like a parent,
151,What is worse for you: fail or not try?,,,,
152,Should everything be under control?,,,,
153,Are you prone to any kind of addiction?,,,,
154,Do you know your true desires?,,,,
155,Are you always able to discern your feelings?,,,,
156,What element do you most associate your character with?,,,,
157,How do you feel about animals?,I like animals a lot!,I'm neutral,I only love some animals,
158,Do you find it difficult to sit in a chair for a long time?,"Yes, it is difficult",No it's easy,,
159,How easy is it for you to get up to an alarm clock?,Getting up early is easy for me,Always different,Very hard,I skip the alarm and go to sleep
160,What was your favorite subject at school?,"Math, physics","Language, Literature, Art",Physical education,
161,What do you think about sports?,Excellent! I love sports,A good way to beautify my figure from time to time,I don’t like sports,I just like watching sports on TV
162,"If you are borrowed money, do you need to be reminded about it?",,,,
163,Can you call yourself an impulsive person?,,,,
164,How often do you experience anxiety?,I often struggle with internal anxiety,Occasional moments of anxiety,"No, I’m always calm",
165,Do you like being the center of attention?,,,,
166,How do you like to spend your time?,Alone,In the company of people,,
167,Is it easy for you to ask for forgiveness?,,,,
168,Do you like to visit others often?,,,,
169,Does your mood depend on the weather?,"Yes, I'm a weather person","No, the weather doesn't affect my mood",,
170,Are you willing to take risks?,,,,
171,Who are you at events?,I prefer to sit and watch others,I prefer to take part in the fun,,
172,How do you feel about injustice?,I'm a supporter of justice,I get lost and helpless at injustice,Nobody is perfect,
173,Can you be called a distrustful and cautious person?,"Yes, I hardly open up to other people","No, I get close to other people easily",,
174,How do you feel about profit?,I don't mind finding favorable conditions for myself,,,
175,Do you prefer to be silent or talk more?,,,,
176,Are you comfortable with new people?,"Yes, it's easy for me among strangers","No, I feel stuck with strangers",,
177,Are you a touchy person?,"Yes, sometimes I get offended",Only if the situation is really serious,"No, I see no reason to be offended often",
178,Do you take life hard?,"There is nothing that would be given ""just like that""",Life really seems hard at times,"I don't focus on problems, life is beautiful",
179,Did you like literature at school?,,,,
180,How do you feel about alcohol?,,I only drink on special occasions,I don’t drink,
181,"When you wake up, do you think about your to-do list?",,,,
182,What is your reaction when someone yells at you?,Give an aggressive response,Prefer to fight back without emotion,Start to cry,Silence and feeling shame/guilt
183,Are you most often silent in the company of other people?,,,,
184,How do you experience loneliness?,I always need communication and I'm afraid of loneliness,I'm comfortable alone,,
185,Can you call yourself careless person?,,,,
186,Are you a shy person?,,,,
187,Are you filled with strength among other people or alone?,In the circle of other people,In seclusion,,
188,Do you always keep your promises?,"Yes, I try to always keep my promises","No, sometimes it doesn't work",,
189,Can you be called a lively person?,,,,
190,Do you often regret when you've said too much?,,,,
191,Do you feel a strong connection to your parents?,,,,
192,Are you comfortable with new technology?,I'm good with gadgets,For me it's hard,,
193,Do you think all people are equal?,,,,
194,Do you love treats and delicacies?,I love delicious food!,It is not the most important thing for me,I'm on a diet,"If I could, I wouldn't eat at all"
195,Do you like decorating space around you?,,,,
196,Do you often need friends?,"Yes, it is very important for me to have friends nearby","Not often, I'm neutral about meeting with friends","No, I'm comfortable being alone",
197,What is fits you better?,Reflect on life alone,Spending time in noisy company,,
198,How much time do you spend on social media?,I'm on social media 24/7,,I don't use social media,
199,Does something new inspire or bore you?,Inspire,Bore,,
200,Do you consider yourself a serious person?,"Yes, seriousness is important to me","No, this is out of my character",,
201,How do you look at the future?,,,,
202,What is your favorite genre of films?,,,,
203,Is travel important for you?,I love traveling and exploring new places!,I'm neutral about travel,It doesn't attract me,
204,Sushi or pizza?,,,,
205,Can you call yourself a homebody?,"Yes, I love spending time at home",I like to spend a lot of time away from home,,
206,Do you consider your childhood happy?,"Yes, I fondly remember my childhood",No it wasn't happy,,
207,Are you a jealous person?,"Yes, I'm a terrible owner",From time to time,"No, I don't get jealous",
208,Do you get along well with your family?,,Always different,,
209,Do you like outdoor activities?,,,,
210,Do you like walking around the city at night?,,,,
211,Do you have friends you've known since childhood?,,,,
212,"If you could make a movie about your life, what genre would it be?",,,,
213,Can you read other people by gestures?,,,,
214,Do you trust your intuition?,Intuition often helps me in my life,Very rarely,"No, I don't have it",
215,Do you like extreme things?,,,,
216,When did you realize that you became an adult?,"Since birth, I feel more mature than others",When faced with difficulties and responsibility,Didn't notice when I grew up,I don't feel like an adult yet
217,Are you guided by emotions or reason making decisions?,,,,
218,Did you enjoy your high school years?,,,,
219,Do you believe in otherworldly forces?,"Yes, I believe ","No, I don't believe in it",Don't believe but don't deny it either,
220,Do you always have time to do things you want to do?,I keep failing!,I have enough time for all my tasks,Sometimes I can't get everything done,
221,Do you like to be in nature?,,,,
222,Were you an exemplary student at school?,,,,
223,What is your favorite style of clothing?,"Neutral, free","Classic, business style",Sports,Extraordinary
224,What is your favorite time of day?,,,,
225,What in people attracts you?,"Pressure, activity","Sensuality, emotionality",Intellectual development,"Focus on success, money, and ambition"
226,Do you believe that dreams can be prophetic?,,,,
227,Should a woman work or look after a home?,This is her personal choice,She should work,She should only do housework,
228,Do you value friendship?,,,,
229,Do you plan your budget?,,,,
230,Do you love being a leader?,,,Depends on the environment,
231,Do you consider yourself a talented person?,"Yes, I consider myself gifted in certain areas",,"Talent doesn't exist, skill exists",
232,Do you believe in horoscopes and premonitions?,,,,
233,Do you like vacations with your family?,,,,
234,Do you believe in friendship between a woman and a man?,,,,
235,Do you like teaching other people and giving advice?,,,,
236,Are you good at making concessions?,I easily compromise,"It's hard for me, but I try","No, I always stand my ground",
237,What is the worst part of your life right now?,,,,
238,Do you often admit to your mistakes?,,,,
239,Do you have a wishlist?,,,I'll go write one,
240,Do you believe in friendship between exes?,"Yes, exes can be on friends ",In such a relationship there is no place for friendship ,There can only be a fake friendship ,
241,Do you quickly understand the true essence of a person after meeting?,"Yes, I'm a good psychologist",I don't jump to conclusions about a person,Always different,
242,Avoid your fear or face it?,Avoid your fear,Meet it face to face,,
243,What color would best identify you?,,,,
244,Would you risk your life to save someone else's?,,,,
245,How would your best friends describe you?,,,,
246,Are you a passionate person or cold-hearted?,,,,
247,Do you believe in karma?,"Yes, I believe in the boomerang law: actions have consequences","No, I don't believe in karma",,
248,Is it better to travel alone or with friends?,,,,
249,Do you fall in love easily?,,,,
250,How do you react to pranks?,Pranks make me laugh,They bring me confusion,I'm angry and upset by pranks,
251,Do you fall in love quickly?,"Yes, it's fast and easy","Yes, it's fast and easy",,
252,Do you have your own signature cocktail or specialty?,,,,
253,Would you like to become popular?,"Yes, this is an old dream","Would be great, but not required","No, I'm not interested",
254,Are you on Santa Claus' naughty or nice list?,Nice kids,Naughty kids,,
255,What will you do in old age?,Dedicate my time to my family,I'll take up gardening,I'll go on a trip,
256,How many times have you had your heart broken?,,It happened a couple of times,Never broken,It's me who breaks hearts
257,Which vacation would you prefer?,Excursions to historical places,Beach leisure,Hanging out with friends at a wild party,Romantic dinner at the best restaurant
258,Who would you like to spend one day on a desert island with?,With family,,With the love of my life,I'd prefer to be alone
259,In which city would you prefer to live?,,,,
260,What do you like to do in your free time?,,Watching TV series,,
261,What communication format do you prefer?,Live,By correspondence,,
262,What is important to you on a perfect date?,,,,
263,Dogs or cats?,,,Either or,
264,What is your priority when choosing a person for communication?,Appearance,Communication,Intelligence,Prospects
265,What do you need to relax?,A little rest,Gatherings with 2-3 close friends,Crowded party in the club,
266,Happiness for you lies in family values or a successful career?,In family values,In career,,
