Id,Question,A,B,C,D
267,"Does the ""everyday life"" in a relationship scare you?",I believe that it spoils relationships,It cannot affect the quality of relationships,True love overcomes all difficulties,
268,How do you feel about kids?,"They scream terribly, I don't like them",I'm neutral towards them,I love babies!,
269,What is a family's foundation for you?,Patriarchal relationships ,Gender equality,Matriarchal relationships ,
270,What do you want to watch this evening?,Psychological thriller with a poignant plot,New edition of the comedy show,,
271,What are your favorite flavors?,"Tough, strong","Delicate, floral",Sweet,I don't like any flavors
272,How do you feel about tattoos?,"I like tattoos, already have or want to get one",I like how tattoos looks on people ,I don't like tattoos,
273,Coffee or tea?,,,,
274,Which type are you?,"Extrovert - oriented ""outward""","Introvert - oriented ""inward""",,
275,Swimming lessons or piano lessons?,,,,
276,Read books or watch movies?,,,,
277,What online communication format do you prefer?,,,,
278,What is your priority?,,,,
279,Where do you prefer: the beach or the mountains?,,,,
280,Work in an office or at home?,In the office,At home,I don’t want to work,
281,Would you rather be born in the future or in the past?,In the future!,I want to live here and now in the present!,In the past!,
282,What would you choose?,Find the love of your life and die,Live for eternity alone,,
283,Which superpower would you choose?,To be invisible,Be able to read minds,Teleport to anywhere in the world,See the future
284,To be a hero or a villain?,,Be a villain,,
285,To be very smart or very lucky?,,,,
286,To be famous online or in real life?,,In real life,I don't want to be famous,
287,You're at a party full of strangers. Your actions?,Quickly turn around and go home,Wait until someone comes up to me,I will get to know everyone right away,
288,What can't you leave the house without?,,,,
289,Choose a flavor for your birthday cake,,,,
290,What values do you want to teach your children?,"Peace, cruelty, and injustice",It's important to follow the rules,Hard work pays off,The world is full of wonders
291,Who do you think you were in a past life?,I was from a noble family,I was someone special,I was an animal,I was some kind of peasant
292,Is the glass half empty or half full?,,,,
293,Do you believe in the existence of extraterrestrial life?,,,,
294,Where do you feel best?,At home,On the stage,Traveling,With friends
295,What quality describes you best?,Extraordinary,"Pushy, aggressive",,
296,What is the meaning of your life?,Service!,Help people in need!,Make the impossible possible!,Build a family empire!
297,Do you have a lot of friends?,"Some, only a few are really close to me","Yes, I have a lot of friends",I have no friends,
298,You are in a toxic relationship. Your actions?,Leave immediately,Affection and feelings are the most important,,
299,How do you feel about conflicts?,Avoid them,I defend my rightness in a dispute,"I don’t interfere in conflicts, I keep neutrality",
300,How would you describe yourself in a relationship?,I'm all for being led in a relationship,I take the lead in relationships,I'm for equality and partnerships,
301,Do you prefer to stand out or blend in with the crowd?,Stand out,Blend in,,
302,To be in power or to be an executor of tasks?,,,,
303,How do you feel about studying?,I can't stand learning new things!,I love learning new things!,,I'd prefer to be a teacher rather than a student
304,What is your power?,Service to something or someone,Discipline,Creation,Reliability
305,Do you like fantasy films?,,,,
306,What element of nature you are most comfortable interacting with?,,,,
307,Do you like to dance?,,,,
308,How do you act when making a decision?,Act spontaneously,Think everything through carefully,,
309,With whom do you prefer to celebrate anniversaries?,In a big fun company,In a narrow circle of friends,,
310,Which of these two words do you like best?,,,,
311,"If someone talks about you a little rudely, you...",Take it as a joke,You'll be mad at the person,,
312,What do you value more in yourself?,Individuality,Devotion,,
313,"If you were a musical artist, would you prefer...",Perform in a band,Solo career,,
314,Do you like it better when you express your thoughts...,Clear and distinct,Original and unusual,,
315,Planned schedule...,,,,
316,More important for you...,To achieve the result,Enjoy the process,,
317,"When you need to come up with a non-standard way out, you...",Considering many options,Insist on the only one,,
318,"If someone around you starts talking outright nonsense, you...",I will keep silent so as not to start a discussion,You still have the right point of view,,
319,Who do you think is worse?,Unreasonable person,An unkind person,,
320,"When making decisions, you often rely on...",Your own opinion,The opinion of the majority,,
321,Visionaries and dreamers...,Irk me,Fascinate me,,
322,Are you saving money for the future?,"Yes, definitely",As it suits me,"No, I spend what money I have",
323,Your teammate has just made another mistake. Your actions?,Tell him how to act correctly in this case,"Cheer him up, don't focus on it",Give a negative opinion about his abilities,Bring his competence into question at the next general meeting 
324,"If you take on a task, will you definitely complete it?","Yes, no matter the situation","Not necessarily, I'll assess my losses and gains","No, the situation may change","No, I may not succeed or not have enough determination"
325,Do you do things based on emotions rather than logic?,"Yes, all people are affected by emotions","No, logic should always be prioritized",,
326,Do you find it easy to get close to people?,Always easy,Not easy,,
327,Do you have a lot of friends?,,,,
328,Would you worry if you could not communicate with people for a long time?,,,,
329,Are you good at noticing changes in other people's emotions and intonations?,,,,
330,On whom do you focus more?,On myself,On others,,
331,Is it easy for you to show your affection to other people?,"Yes, I openly express it ","No, it's hard for me ",,
332,Do you like to experiment in love?,,,,
333,How do you show love more?,,,,
334,Do you feel uncomfortable when you have to express your emotions?,,,,
335,How do you usually talk to a person?,"Loud, at close range","Openly with close people, not with strangers",Restrained and cold,"Emotional, humorous"
336,You've just bought a smartphone that suddenly shut off. Your actions?,I'm taking it back to the store,Blame myself for it ,Try to fix the problem myself,Contact a competent repairman
337,Has your best friend ever lied to you?,,,,
338,The week was busy and you are tired. How will you spend your weekend?,I'll call my friends and invite them to meet up,"Put my phone on airplane mode, stay at home",,
339,Which of the two descriptions describes you best?,What is happening here and now is what matters to me,I love dreaming and scheduling future events,,
340,Do you believe in love at first sight?,,,,
341,What kind of person are you?,I prefer to make a plan and then follow it,I'm full of childish energy and cheerfulness,"I am tactful, delicate, and polite with others",
342,What difficulties do you face most often?,"I'm hard to please, I'm vindictive",I find it difficult to make decisions,I find it difficult to express my feelings,I find it difficult to do routine work
343,You have been asked to make a toast. What is your reaction?,"I hate giving toasts, I'll try to get out of it",I'm a good storyteller Everyone will be delighted,I'll say something smart and to the point,
344,What do you hear more often about your speeches?,“Can’t you go faster? You’re milking the clock again!”,"“Please, slow down. You are in a hurry again.”",,
345,Are you often afraid that the person you love will stop loving you?,,,,
346,You are at an exhibition. What attracts you most about the art?,"Color, perfection of form",Their internal structure (how and what they are made of),Exhibit history,Together
347,What personality traits do you like the most in a person?,"Friendliness, sensitivity, lack of self-interest","Courage, bravery, endurance",,
348,You have a lot of free time. What will you devote your time to?,Something practical (crafting things by hand),Сommunity service,,
349,"If there were two clubs at school, which one would you choose?",,,,
350,What books do you like to read the most?,Literary and artistic,Popular science,,
351,What would you choose?,Be poor but happy,Be very rich but suffer from depression,,
352,You and your friends are in trouble. Your actions?,I will sacrifice myself for my friends,I always have a plan B,I will run away,I'll rely on friends to solve the problem
353,How do you play games?,Aggressive and fast,Strategically and slowly,,
354,How often do you lie?,Happens often,,Always tell the truth,
355,Do you like being alone?,,,,
356,What do you like to do in your free time?,Read,Create something new,Listen to music,Play sports
357,To be alone or part of a couple?,To be alone,Be with someone,,
358,How do you deal with chaos in your life?,It throws me off balance,Adapt to what's going on,I love it when things change!,
359,You are in a wild area. What are you exploring?,,,,
360,You are writing a poem. What is it about?,,,,About the surreal
361,What is your favorite type of transport?,,,,
362,How would you spend a vacation in another country?,I will visit the museums of the country,I will stay at the hotel,I'll go to a party and have a blast,Explore the area and go to the beach
363,Which of these two books would you most enjoy reading?,About the development of science in our country,About the achievements of athletes of our country,,
364,Do you love to gossip?,,,,
365,Do you consider yourself a calm person?,"Yes, I'm peaceful and harmonious",Depends on the period in my life,"No, I often feel anxious",
366,Do you put family first in your priorities?,"Yes, family is the most important thing for me!","Family is important, but not on the top","No, it's not that important to me",
367,Rapping or singing?,,,,
368,Do you consider yourself a relaxed and non-conformist person?,,,,
369,Do you try to avoid confrontations?,"Yes, conflicts throw me off balance","If the topic of conflict is very important to me, I'll speak up",Arguing and finding out who is right,I never argue with anyone
370,Is work the primary place for you?,,,,
371,Do you consider yourself a loyal person?,,,Loyalty is long gone,
372,Do you find it hard to say no to those you feel sorry for?,,,,
373,Do you like puzzles and unusual tasks?,,,,
374,Do you think you have a mission on the planet (higher calling)?,"Yes, I was born for something great","No, I don't believe it",,
375,"Do you have a tender, sentimental side?",,,,
376,"In your opinion, are you a person with excellent manners?","Yes, education is above all",,,
377,You ended up on a desert island. What is your first step?,Looking for other survivors,Find drinking water and food,Look for shelter,Find a weapon to defend yourself
378,What are your actions if you have to live with a conflicting unfamiliar person?,I will move at any cost,Do anything to make friends with my neighbor,"Set clear boundaries, minimize contact ","Will not avoid conflict, express everything"
379,You've been assigned a huge amount of paperwork with an approaching deadline. Your actions?,Save everything for the last day,Do everything as quick as possible,Break the work into parts,Try my best to get away from this job
380,You've been asked to tutor a child. Your actions?,Help and not accept payment for it,Agree only for a worthy amount of money,Refuse,"Agree, I like to gain new experience and hone my skills"
381,"Your friend showed you his art, and it's frankly terrible. Your actions?",Not show what you think and admire his work,Say that the work is awful,Praise your friend and gently point out mistakes,Say that you can not objectively evaluate
382,What are you most afraid of?,,Condemnation of others,,Lose the ones I love
383,Your two friends like each other romantically. What will you do?,I'll hint to both that they like each other,"I won't do anything, they have to decide for themselves",Arrange a secret date,Loudly declare in front of them that they like each other
384,"You obtain a physical defect (for example, a scar on your face). What is your reaction?",Appearance has never played a major role in my life,It will be a shock; try to mask it,I'm sure there is a way to revert to my old look,Eventually I can get used to it and get my life back
385,What is power?,,,,
386,What is your priority in a relationship when conflict arises?,I strive hard to get my way,I try to calm my partner down and save our relationship,I renounce my ideas for the sake of my partner,
387,Do you have jerky movements?,,,,
388,Are you quick to memorize new information?,,,,
389,Do you often think how your actions impact on others?,,,,
390,Which of the following qualities do you value most in people?,Persistence,Breadth of thinking,"Efficiency, the ability to ""show yourself""",
391,Are you prone to pedantry?,,,,
392,Do you quickly forget about the troubles that happen to you?,,,,
393,Do you like to analyze your actions?,,,,
394,Which of the following definitions best suits you?,,,,
395,What would you do if an opponent personally offended you?,Answer them in the same tone or even harsher,"Ignore it, they're just tired",Become defiantly offended,
396,"If you mess up, who do you blame first?",,"""Fatal"" bad luck",Other circumstances,
397,Do you sometimes lose youself in a relationship?,,,,
398,Do you feel like you can forget or neglect yourself in a relationship?,,,,
399,"When your partner doesn't keep their word, do you take it personally?",,,,
400,Do you ask other people for help?,"Yes, it isn't hard for me","Don't like asking for help, I don't need it",It's hard for me to ask help,
401,Do you find it easy to balance independence and intimacy in a relationship?,,,,
402,What's your role in the team?,,,Sage,Attendant
403,Do you like trying new things?,,,,
404,Are you trying to lead a healthy lifestyle?,,,,
405,Choose the qualities that resonate with you the most,Charity and equality,Drive and swiftness,Industriousness,Ideas and innovations
406,Do you often feel like you need friends who can understand and encourage you?,,,,
407,Do you get embarrassed when you meet a nice person of the opposite sex?,,,,
408,Does it often happen that you act thoughtlessly?,,,,
409,Do you like to be in company of people often?,,,,
410,Do you try to limit your social circle to a small number of your closest friends?,,,,
411,Do you dream a lot?,,,,
412,Do you consider yourself a fun person?,,,,
413,Do you feel restless being in a big company?,,,,
414,Do you like tasks that require concentration?,,,,
415,Do you like to play pranks on others?,,,,
416,Would you prefer to live in a house that is...,In a populated city,Something in between,Lonely in the deep forests,
417,"When talking to people, you...",Are ready to enter into conversation,Something in between,I prefer to stay away,
418,Can money buy happiness?,,,,
419,During speaking you prefer to...,Express your thoughts without thinking,Speak out carefully in advance,,
420,Do you always achieve your goals?,"Yes, I finish what I've started","No, sometimes I leave the goal unfulfilled",,
421,Do people think you're an interesting storyteller?,"Yes, I can tell interesting stories",No they don't,,
422,"When you see sloppy, unkempt people, you...",You accept them for who they are,Are disgusted,,
423,Do you feel embarrassed if you suddenly find yourself in the center of attention?,,,,
424,"At school, you preferred...","Practice music, singing","Wood shop, crafting something",Engaging in science,Learning languages
425,Do you think it's more important that parents...,Help children develop their senses,Teach children to restrain their feelings,,
426,Do you think we need...,"More serious, down to earth people",More dreamers planning for a better future,,
427,Did you willingly take part in sporting events in your youth?,,Depends on whether I'm good at the sport,,
428,"Do you usually keep silent in the presence of people older in age, experience, and position?",,,,
429,Are you good at navigating and remembering unfamiliar places?,,,,
430,Would you rather work on your own than work with others?,,,,
431,Would you like a quiet life more than fame and noisy success?,,,,
432,Do you feel like a mature person?,"Yes, I feel like a person who has already gathered experience",,"No, childishness is closer for me",
433,How do you feel about obscene words?,"Quietly, I often use them in conversation",I only use them when I'm caught off guard,I'm against swearing,
434,Do you prefer film...,With more military and political battles,With many feelings and imagination,,
435,How do you feel about it if someone starts to give you commands?,Most of the time I agree with what they say,"Rebel inside myself, but agree",Express resistance,Only I can command others
436,Would you rather have a job...,With a constant modest salary,Big pay but risky job,,
437,"To be informed, do you prefer to receive information through...",Communication with other people,Media sources on the internet or TV,,
438,Do you enjoy taking an active part in community work?,,,,
439,You are better described as...,,,,
440,Do you get angry with people too quickly?,,,,
441,Does the sight of uncleaned room irritate you?,"Yes, I don't like mess","No, I take it easy",,
442,Do you consider yourself a hardworking person?,"Yes, labor is my middle name",,"No, sometimes work is hard for me",
443,Would you like to spend the evening in a quiet favorite activity or in a lively company?,Spend time doing what I love,Among the people,,
444,Do you like it when someone watches you work?,,,,
445,"At school, did you prefer...",Language and Literature,Mathematics,,
446,"Cooking a new dish, you...",Stick to the recipe,Improvize while cooking,,
447,"Looking forward to something in the future, you feel better when...",I have everything planned out in advance,There are many variables for development,,
448,Which statement describes you best?,Seem to be a closed person,Seem very sociable to people,,
449,"To sum up your description, you are a...",Thoughtful and somewhat impractical person,Practical and fact-focused person,,
450,"When interacting with others, you are...",An open and kind person,A closed and cold person,,
451,Which statement describes you best?,I like to share my ideas with others,I like to brainstorm ideas alone,,
452,Which statement describes you best?,,,,
453,"When interacting with other people, you don't like it when...",One is indifferent to other people's feelings,One gets the facts wrong and doesn't think logically,,
454,What kind of hero would you like to be?,Shakespeare,Einstein,,
455,"In your opinion, when are people most likely to make mistakes?",When they don't listen to common sense,When they don't listen to their heart,,
456,How do you feel about planning?,I prefer being organized,I prefer spontaneity,,
457,Your leadership abilities are characterized by...,Indecisiveness and pliability,Control and rigor,Optimism and openness,
458,How do you feel about control?,I like to check everything,I'm careless and sometimes I let everything take its own course,,
459,"After the party, others will probably say that you...",Talked too much,Mostly kept quiet and listened to others,,
460,Which statement describes you best?,"In communication, I take everything at face value","In communication, I'm constantly looking for hidden motives",,
461,What annoys you the most is when people...,Cannot act in an organized and collected manner,Too conservative and lacking spontaneity,,
462,What type of teacher annoys you more?,The teacher who talks abstractly,A teacher who is too rational,,
463,Do you believe in equality between people?,All people are equal,There is a social difference between people,,
464,Do you admit your mistakes and learn from them?,,,,
465,Do you have a clear idea of where you want to go in life?,,,,
466,"In your opinion, do you have a self-preservation instinct (physical and moral)?","Yes, I protect myself from danger","No, sometimes I put myself in great danger",,
467,Are you very active and don't spend much time doing nothing?,,,,
468,Can you manipulate and influence others when the situation calls for it?,"Yes, I often resort to psychological maneuvers","Happens, but rarely","No, sometimes I put myself in great danger",
469,Do you seek revenge when you've been wronged?,,,"Sometimes, but not always",
470,Do you often use abstract and complex words in your writing and speech?,,,,
471,Do you prefer being a teammate or being in charge?,Be on a team,Be a leader,,
472,"Do you aspire to be someone who spreads enthusiasm among friends, colleagues, and loved ones?",,,,
473,Do you love getting compliments?,"Yes, I love to hear nice words addressed to me",I'm embarrassed by compliments ,"No, I don't like it",
474,Are you comfortable in leadership positions?,,,,
475,Are family traditions important to you?,,,,
476,Do you think you have an inquisitive mind?,"Yes, I am a very curious person","No, I can't say that about myself",,
477,Do you often find yourself daydreaming or getting lost in your own world?,"Yes, I'm a born dreamer",,,
478,Do you solve problems by following your intuition?,,,,
479,You are out of the house without an umbrella. It started to rain and you got wet. Are you upset?,"No, I always think positively","Yes, the weather will annoy me",,
480,Is winning important to you?,"Yes, I'll do anything to win",,"No, winning is not so important to me",
481,Is it easy to make you feel anxious?,,,,
482,Are you ready to commit to a relationship?,,,,
483,"Are you often described as a sensitive, attentive, and polite person?",,,,
484,Are you afraid of heights?,,Depend on the height,,
485,Do you get along with cats?,"No, I don't really like animals",They are cute but without fanaticism,Of course I'm a cat person!,
486,Do things happen that you already knew would happen?,"Yes, I see the development of events in advance",,,
487,Do you believe in omens?,,No it's nonsense,,
488,Main thing on Saturdays is...,Clean up and meet with people,Sleep too much,Make a fuss,Do a lot of things
489,How do you solve problems?,I turn on the logic and draw up an action plan,In sophisticated ways,Waiting for them to resolve themselves,I ask for help
490,At your home there is always...,Cleanliness and tidiness,"Coldness, like in a crypt",A lot of food,Mess
491,Choose a character that you love in yourself,Society,Determination,Equilibrium,Sensitivity
492,Do you keep yourself fit?,"I regularly go training, but only to relax","Keep a diet, I play sports and regularly lift weights","Yes, but without obsession, yoga and pool are the best for me",
493,What does your perfect summer vacation look like?,Measured rest with comfort,Yoga-tour high in the mountains,Traveling Hitchhiking with Friends,Excursion tour of ancient cities
494,What in a person can you push you away?,Coarseness,Sluggishness,Craving for bad habits,Laziness
495,How do you feel about friendship?,"Have many friends, try to pay attention to everyone ",I have a certain circle of close friends,"I don’t immediately open up, so I choose friends for the long term","I quickly take new friends, but I also quickly lose interest "
496,Your colleague is tired and complains about a headache to the leadership. What do you think about this?,"I sympathize, headaches are unpleasant",He's a whiner,"I roll my eyes, he's definitely lying to leave early",
497,Rules are needed...,To avoid the chaos,To break them,,
498,Long work is...,Terrible,"Acceptable, there is no getting away from it",My passion,
499,What do you think about after waking up in the morning?,Of course about breakfast,What the weather will be,About upcoming tasks,
500,Where do you take energy?,"From difficult situations, they activate me",From communication,"Shopping, I seem to come to life","From conflicts, 'til Valhalla!"
501,How does your morning begin?,I check social networks,From a glass of water,"I sleep until lunch, I don't experience mornings",With a hearty breakfast 
502,"If you are in danger, what will you do?",I will run away,The best defense is a good offense,Ask for help from relatives,I'm always safe!
503,What will you eat for lunch?,"Cabbage, I'm on a diet",Can you get sweets for lunch?,Meat and vegetables,Fast food
504,Children are...,Difficulties,The meaning of life,Logical continuation of love,I find it difficult to answer
505,On the way to work or study...,I sleep on public transport,I work or study from home,I look at passers -by and their faces,I check email and social networks
506,In the evening you...,Lie in bed without strength,Go to the gym,Have dinner with friends or loved ones,"Watch videos, films, TV shows"
507,"A friend has betrayed you, what will you do?",I will cross them out of my life,I will wait for an apology,I will throw a tantrum and express everything ,"Nothing, I will observe"
508,What do you do if you feel that you've become sick?,I buy medicine,I delay a visit to the doctor and hope that it will somehow pass,I call the doctor and follow his recommendations,I'm never sick
509,Do you keep a diary?,"Yes, for many years",I don't have time for such things,,
510,How do you deal with stress?,I cry and eat a lot,I work more,Watch movies,Consult with loved ones
511,In what area do you most often have problems?,In health,In finance and career,In personal life,In self-development
512,What do you think annoys your friends about you?,I'm toxic,I easily lose myself,I'm quite vengeful,I'm awkward
513,How do you make decisions?,I go forward with strength and taking the first step,I consult with specialists,I ask what loved ones would do,
514,Do you notice that you are trying to please everyone?,Constantly,I put my needs at the top,,
